{
  "cases": [
    {
      "case_id": "first-tick-only-records-the-week",
      "expected": {
        "final_state": {
          "config": {
            "last_digest_week": "2026-08-26T16:00:00+00:00",
            "last_materialised_week": null
          },
          "fixed_runs": [],
          "reminders": [],
          "rsvps": [],
          "runs": [],
          "side_effects": [],
          "weekly_digests": []
        },
        "steps": [
          {
            "value": null
          },
          {
            "value": null
          }
        ]
      },
      "input": {
        "available_channel_ids": [
          "222",
          "555"
        ],
        "catalog": {
          "bosses": [
            {
              "aliases": [
                "star",
                "mstar"
              ],
              "difficulties": [
                "n",
                "h"
              ],
              "full": "Malefic Star",
              "short": "MaleficStar"
            },
            {
              "aliases": [
                "fa"
              ],
              "full": "First Adversary",
              "short": "FA"
            },
            {
              "aliases": [
                "kalos"
              ],
              "difficulties": [
                "n",
                "x"
              ],
              "full": "Kalos",
              "short": "Kalos"
            }
          ],
          "difficulties": [
            {
              "label": "Normal",
              "prefix": "n"
            },
            {
              "label": "Hard",
              "prefix": "h"
            },
            {
              "label": "Extreme",
              "prefix": "x"
            }
          ]
        },
        "clock": "2026-08-30T12:00:00+08:00",
        "countdowns": [
          60,
          15
        ],
        "guild_id": "111",
        "members": [
          {
            "display_name": "Alvin",
            "has_role": true,
            "nickname": null,
            "ping_level": "all",
            "user_id": "1001"
          },
          {
            "display_name": "kanon [AZUR]",
            "has_role": true,
            "nickname": "kanon",
            "ping_level": "essential",
            "user_id": "1002"
          },
          {
            "display_name": "Priya",
            "has_role": true,
            "nickname": null,
            "ping_level": "off",
            "user_id": "1003"
          }
        ],
        "ping_time": "09:00:00",
        "post_channel_id": "555",
        "reset_time": "00:00:00",
        "reset_weekday": 3,
        "steps": [
          {
            "op": "post_week_digest"
          },
          {
            "op": "post_week_digest"
          }
        ],
        "timezone": "Asia/Kuala_Lumpur",
        "uuid_sequence": [
          "00000001-0000-4000-8005-000000000000",
          "00000002-0000-4000-8005-000000000000",
          "00000003-0000-4000-8005-000000000000",
          "00000004-0000-4000-8005-000000000000",
          "00000005-0000-4000-8005-000000000000",
          "00000006-0000-4000-8005-000000000000",
          "00000007-0000-4000-8005-000000000000",
          "00000008-0000-4000-8005-000000000000",
          "00000009-0000-4000-8005-000000000000",
          "0000000a-0000-4000-8005-000000000000",
          "0000000b-0000-4000-8005-000000000000",
          "0000000c-0000-4000-8005-000000000000",
          "0000000d-0000-4000-8005-000000000000",
          "0000000e-0000-4000-8005-000000000000",
          "0000000f-0000-4000-8005-000000000000",
          "00000010-0000-4000-8005-000000000000",
          "00000011-0000-4000-8005-000000000000",
          "00000012-0000-4000-8005-000000000000",
          "00000013-0000-4000-8005-000000000000",
          "00000014-0000-4000-8005-000000000000",
          "00000015-0000-4000-8005-000000000000",
          "00000016-0000-4000-8005-000000000000",
          "00000017-0000-4000-8005-000000000000",
          "00000018-0000-4000-8005-000000000000",
          "00000019-0000-4000-8005-000000000000",
          "0000001a-0000-4000-8005-000000000000",
          "0000001b-0000-4000-8005-000000000000",
          "0000001c-0000-4000-8005-000000000000",
          "0000001d-0000-4000-8005-000000000000",
          "0000001e-0000-4000-8005-000000000000",
          "0000001f-0000-4000-8005-000000000000",
          "00000020-0000-4000-8005-000000000000",
          "00000021-0000-4000-8005-000000000000",
          "00000022-0000-4000-8005-000000000000",
          "00000023-0000-4000-8005-000000000000",
          "00000024-0000-4000-8005-000000000000",
          "00000025-0000-4000-8005-000000000000",
          "00000026-0000-4000-8005-000000000000",
          "00000027-0000-4000-8005-000000000000",
          "00000028-0000-4000-8005-000000000000",
          "00000029-0000-4000-8005-000000000000",
          "0000002a-0000-4000-8005-000000000000",
          "0000002b-0000-4000-8005-000000000000",
          "0000002c-0000-4000-8005-000000000000",
          "0000002d-0000-4000-8005-000000000000",
          "0000002e-0000-4000-8005-000000000000",
          "0000002f-0000-4000-8005-000000000000",
          "00000030-0000-4000-8005-000000000000",
          "00000031-0000-4000-8005-000000000000",
          "00000032-0000-4000-8005-000000000000",
          "00000033-0000-4000-8005-000000000000",
          "00000034-0000-4000-8005-000000000000",
          "00000035-0000-4000-8005-000000000000",
          "00000036-0000-4000-8005-000000000000",
          "00000037-0000-4000-8005-000000000000",
          "00000038-0000-4000-8005-000000000000",
          "00000039-0000-4000-8005-000000000000",
          "0000003a-0000-4000-8005-000000000000",
          "0000003b-0000-4000-8005-000000000000",
          "0000003c-0000-4000-8005-000000000000",
          "0000003d-0000-4000-8005-000000000000",
          "0000003e-0000-4000-8005-000000000000",
          "0000003f-0000-4000-8005-000000000000",
          "00000040-0000-4000-8005-000000000000",
          "00000041-0000-4000-8005-000000000000",
          "00000042-0000-4000-8005-000000000000",
          "00000043-0000-4000-8005-000000000000",
          "00000044-0000-4000-8005-000000000000",
          "00000045-0000-4000-8005-000000000000",
          "00000046-0000-4000-8005-000000000000",
          "00000047-0000-4000-8005-000000000000",
          "00000048-0000-4000-8005-000000000000",
          "00000049-0000-4000-8005-000000000000",
          "0000004a-0000-4000-8005-000000000000",
          "0000004b-0000-4000-8005-000000000000",
          "0000004c-0000-4000-8005-000000000000",
          "0000004d-0000-4000-8005-000000000000",
          "0000004e-0000-4000-8005-000000000000",
          "0000004f-0000-4000-8005-000000000000",
          "00000050-0000-4000-8005-000000000000",
          "00000051-0000-4000-8005-000000000000",
          "00000052-0000-4000-8005-000000000000",
          "00000053-0000-4000-8005-000000000000",
          "00000054-0000-4000-8005-000000000000",
          "00000055-0000-4000-8005-000000000000",
          "00000056-0000-4000-8005-000000000000",
          "00000057-0000-4000-8005-000000000000",
          "00000058-0000-4000-8005-000000000000",
          "00000059-0000-4000-8005-000000000000",
          "0000005a-0000-4000-8005-000000000000",
          "0000005b-0000-4000-8005-000000000000",
          "0000005c-0000-4000-8005-000000000000",
          "0000005d-0000-4000-8005-000000000000",
          "0000005e-0000-4000-8005-000000000000",
          "0000005f-0000-4000-8005-000000000000",
          "00000060-0000-4000-8005-000000000000",
          "00000061-0000-4000-8005-000000000000",
          "00000062-0000-4000-8005-000000000000",
          "00000063-0000-4000-8005-000000000000",
          "00000064-0000-4000-8005-000000000000",
          "00000065-0000-4000-8005-000000000000",
          "00000066-0000-4000-8005-000000000000",
          "00000067-0000-4000-8005-000000000000",
          "00000068-0000-4000-8005-000000000000",
          "00000069-0000-4000-8005-000000000000",
          "0000006a-0000-4000-8005-000000000000",
          "0000006b-0000-4000-8005-000000000000",
          "0000006c-0000-4000-8005-000000000000",
          "0000006d-0000-4000-8005-000000000000",
          "0000006e-0000-4000-8005-000000000000",
          "0000006f-0000-4000-8005-000000000000",
          "00000070-0000-4000-8005-000000000000",
          "00000071-0000-4000-8005-000000000000",
          "00000072-0000-4000-8005-000000000000",
          "00000073-0000-4000-8005-000000000000",
          "00000074-0000-4000-8005-000000000000",
          "00000075-0000-4000-8005-000000000000",
          "00000076-0000-4000-8005-000000000000",
          "00000077-0000-4000-8005-000000000000"
        ]
      }
    },
    {
      "case_id": "reset-posts-once-then-nothing-all-week",
      "expected": {
        "final_state": {
          "config": {
            "last_digest_week": "2026-09-02T16:00:00+00:00",
            "last_materialised_week": null
          },
          "fixed_runs": [],
          "reminders": [],
          "rsvps": [],
          "runs": [],
          "side_effects": [
            {
              "channel_id": "555",
              "dedupe_scope": "native",
              "digest": {
                "at_risk": 0,
                "cleared": 0,
                "days": [],
                "live": 0,
                "unsettled": 0
              },
              "effect_kind": "digest",
              "mention_everyone": false,
              "mentions": [],
              "outcome": "bound",
              "role_mentions": [],
              "targets": [
                {
                  "binding_type": "digest",
                  "key_primary": "2026-09-02T16:00:00+00:00",
                  "key_secondary": null
                }
              ]
            }
          ],
          "weekly_digests": [
            {
              "channel_id": "555",